{
  "$schema": null,
  "spec_id": "01",
  "spec_name": "afspec_go",
  "schema_version": 1,
  "introduction": "The `afspec` Go library provides an idiomatic Go implementation of the Python `afspec` library, enabling Go programs to load, validate, mutate, save, and render agent-fox specification packages with byte-for-byte round-trip fidelity. Note: requirements referencing `github.com/santhosh-tekuri/jsonschema/v6` and `github.com/goccy/go-yaml` APIs are based on the PRD's verified external API surface and should be cross-checked against installed library versions before implementation.",
  "glossary": {
    "BootstrapError": "An error type returned when BootstrapSpec.Finalize fails due to missing artifacts or validation errors",
    "BootstrapSpec": "A struct that supports incremental population of spec artifacts with deferred cross-file validation before assembling a final Spec",
    "BuildDependencyGraph": "A standalone function that builds the inter-spec dependency graph from tasks.json declarations",
    "CompleteSubtaskStates": "A method on Tasks that marks all subtasks in specified groups as done, bypassing the state machine",
    "ComputeCoverage": "A method on TestSpec that computes test coverage by scanning test entries against requirements, properties, and paths",
    "ComputeIntentHash": "A standalone function that computes the SHA-256 hash of the normalized ## Intent section from a PRD body",
    "CreateSpec": "A standalone function that creates a new Spec with initialized sub-artifacts in draft state",
    "DependencyEdge": "A struct representing a directed dependency edge between two specs, carrying FromSpec, ToSpec, FromGroup, ToGroup, and Relationship fields",
    "DependencyGraph": "A struct representing the inter-spec dependency graph built from tasks.json declarations",
    "DiscoverSpecs": "A standalone function that scans a directory for spec directories and returns lightweight SpecMeta entries",
    "EARS": "Easy Approach to Requirements Syntax — a structured natural-language pattern for writing acceptance criteria",
    "Finalize": "The method on BootstrapSpec that assembles a Spec from all set artifacts and runs full validation without saving to disk",
    "IntentError": "An error type returned when ComputeIntentHash cannot find the ## Intent section in a PRD body",
    "IntentHash": "A SHA-256 hash computed over the normalized ## Intent section of a PRD body",
    "IsSpecDirName": "A standalone function that validates whether a directory name matches the NN_snake_case pattern",
    "Kahn's algorithm": "A topological sort algorithm that detects cycles by iteratively removing nodes with no incoming edges",
    "LifecycleError": "An error type returned when an invalid spec or subtask state transition is attempted",
    "LoadError": "An error type returned when a spec directory cannot be loaded due to missing required files or malformed content",
    "LoadSpecLandscape": "A standalone function that collects metadata for all specs for landscape views",
    "MarshalJSON": "A standalone function that produces deterministic JSON serialization matching Python's output byte-for-byte",
    "MoveToArchive": "A standalone function that transitions a spec to archived state and moves its directory to the archive subdirectory",
    "ParseSpecDirName": "A standalone function that parses a directory name matching the NN_snake_case pattern into its components",
    "RenderCombined": "A method on Spec that renders all artifacts as a single Markdown document",
    "RenderEARSSentence": "A method on Criterion that renders a single EARS criterion as a natural-language sentence",
    "RenderIndividual": "A method on Spec that renders each artifact separately as a map of filename to Markdown string",
    "RenderIndividualScoped": "A method on Spec that renders each artifact filtered to the refs of a target task group",
    "ResetSubtaskStates": "A method on Tasks that resets all subtasks in specified groups to pending",
    "SaveError": "An error type returned when a spec cannot be written to disk",
    "Schemas": "A standalone function that returns the bundled JSON Schema files as a map[string][]byte",
    "SchemeURLLoader": "A jsonschema interface implementation that loads schema documents from embedded bytes rather than the network",
    "SpecError": "The base error type for the afspec library; all specific error types wrap it",
    "SpecMeta": "A lightweight struct containing metadata parsed from a spec's PRD frontmatter, used for discovery",
    "Supersede": "A method on Spec that marks a sealed spec as superseded and prepends a deprecation banner to the PRD body",
    "TopologicalSort": "A method on DependencyGraph that returns spec IDs in dependency order using Kahn's algorithm",
    "Transition": "A method on Spec that transitions the spec's lifecycle state and persists the change to disk",
    "TransitionSubtask": "A method on Tasks that transitions a single subtask's state via the state machine",
    "ValidTransition": "A standalone pure function that checks whether a lifecycle state transition is allowed without side effects",
    "ValidateCrossFile": "A method on Spec that checks cross-file consistency including dangling references, coverage gaps, and ID format validation",
    "ValidateCrossSpec": "A standalone function that checks cross-spec interface consistency across multiple specs",
    "ValidateSchema": "A method on Spec that checks each artifact against bundled JSON Schema files and EARS/task-group structural rules",
    "ValidateStructured": "A method on Spec that returns validation results as a categorized map[string]any for CLI consumption",
    "ValidationResult": "A struct containing errors and warnings from spec validation, with a Valid boolean that is true when Errors is empty",
    "active": "A lifecycle state indicating a spec is in active use",
    "afspec": "The Go library (and its Python counterpart) for working with agent-fox specification packages",
    "architecture.md": "An optional Markdown artifact within a spec directory describing the spec's architecture",
    "archived": "A terminal lifecycle state indicating a spec has been moved to the archive directory",
    "done": "A terminal subtask state indicating the subtask has been completed",
    "draft": "The initial lifecycle state of a newly created spec",
    "dropped": "A terminal subtask state indicating the subtask will not be completed",
    "frontmatter": "YAML metadata block delimited by --- at the top of a prd.md file",
    "go-cmp": "The github.com/google/go-cmp package used for structured diffs in test failures",
    "go-yaml": "The github.com/goccy/go-yaml package used for parsing YAML frontmatter in prd.md",
    "in_progress": "A subtask state indicating the subtask is currently being worked on",
    "jsonschema": "The github.com/santhosh-tekuri/jsonschema/v6 package used for JSON Schema validation",
    "pending": "The initial subtask state indicating the subtask has not yet been started",
    "pending_reevaluation": "A subtask state indicating the subtask needs to be re-examined before proceeding",
    "prd.md": "The Product Requirements Document file within a spec directory, containing YAML frontmatter and a Markdown body",
    "queued": "A subtask state indicating the subtask is ready to be worked on",
    "requirement_refs": "A list of requirement IDs referenced by a subtask, used for scoped rendering",
    "requirements.json": "The JSON artifact within a spec directory containing structured requirements",
    "round-trip fidelity": "The property that a spec loaded and saved by the Go library produces byte-for-byte identical output to the Python library",
    "sealed": "A lifecycle state in which a spec cannot be mutated or saved",
    "spec directory": "A filesystem directory matching the NN_name pattern that contains a spec's artifacts",
    "subtask": "An individual unit of work within a task group, tracked with a state machine",
    "superseded": "A terminal lifecycle state indicating a spec has been replaced by another",
    "tasks.json": "The JSON artifact within a spec directory containing task groups and subtasks",
    "test_spec.json": "The JSON artifact within a spec directory containing test specifications",
    "test_spec_refs": "A list of test spec entry IDs referenced by a subtask, used for scoped rendering",
    "testdata": "The directory in the Go repository containing static spec fixture directories extracted from the Python test suite"
  },
  "requirements": [
    {
      "id": "01-REQ-1",
      "title": "LoadSpec — load spec artifacts from a directory",
      "user_story": {
        "role": "Go program",
        "goal": "call LoadSpec(dir) to load all spec artifacts from a directory into a Spec struct",
        "benefit": "so that I can work with spec data natively in Go without shelling out to Python"
      },
      "acceptance_criteria": [
        {
          "id": "01-REQ-1.1",
          "ears_pattern": "event_driven",
          "system": "LoadSpec",
          "action": "reads prd.md, requirements.json, test_spec.json, tasks.json, and optionally architecture.md, parses each artifact into the corresponding Go struct, and returns a populated Spec struct",
          "return_contract": "returns (*Spec, nil)",
          "trigger": "a caller invokes LoadSpec with a valid spec directory path"
        },
        {
          "id": "01-REQ-1.2",
          "ears_pattern": "event_driven",
          "system": "LoadSpec",
          "action": "parses the YAML frontmatter using yaml.Unmarshal and extracts the Markdown body separately, populating all frontmatter fields on the Spec struct",
          "return_contract": "returns (*Spec, nil) with frontmatter fields populated",
          "trigger": "a caller invokes LoadSpec and prd.md contains YAML frontmatter delimited by ---"
        },
        {
          "id": "01-REQ-1.3",
          "ears_pattern": "event_driven",
          "system": "LoadSpec",